{
  "schema": "ihat://identity/authenticator-projection/v1",
  "id": "authenticator/passkey-001",
  "revision": 1,
  "created_at": "2026-08-03T01:00:00.000Z",
  "updated_at": "2026-08-03T01:00:20.000Z",
  "digest": "sha256:4c2c6823168a7fc4d3561a08bb0b67cb4fada4d72e2d6e8038c172b199524c75",
  "audience": "nerp",
  "pairwise_subject": "pairwise_nerp_subject_001",
  "provider_connection_id": "provider-connection/ihat-primary",
  "kind": "passkey",
  "assurance": "phishing-resistant",
  "user_verification": "required",
  "backup_state": "backed-up",
  "status": "active",
  "enrolled_at": "2026-08-03T01:00:05.000Z",
  "last_used_at": "2026-08-03T01:00:20.000Z",
  "revocation_epoch": 0
}
